,Name,Description
0,Acinetobacter baumannii,"Acinetobacter baumannii is a typically short, almost round, rod-shaped (coccobacillus) Gram-negative bacterium. It is named after the bacteriologist Paul Baumann. It can be an opportunistic pathogen in humans, affecting people with compromised immune systems, and is becoming increasingly important as a hospital-derived (nosocomial) infection. While other species of the genus Acinetobacter are often found in soil samples (leading to the common misconception that A. baumannii is a soil organism, too), it is almost exclusively isolated from hospital environments. Although occasionally it has been found in environmental soil and water samples, its natural habitat is still not known.
Bacteria of this genus lack flagella, whip-like structures many bacteria use for locomotion, but exhibit twitching or swarming motility. This may be due to the activity of type IV pili, pole-like structures that can be extended and retracted. Motility in A. baumannii may also be due to the excretion of exopolysaccharide, creating a film of high-molecular-weight sugar chains behind the bacterium to move forward. Clinical microbiologists typically differentiate members of the genus Acinetobacter from other Moraxellaceae by performing an oxidase test, as Acinetobacter spp. are the only members of the Moraxellaceae to lack cytochrome c oxidases.A. baumannii is part of the ACB complex (A. baumannii, A. calcoaceticus, and Acinetobacter genomic species 13TU). It is difficult to determine the specific species of members of the ACB complex and they comprise the most clinically relevant members of the genus. A. baumannii has also been identified as an ESKAPE pathogen (Enterococcus faecium, Staphylococcus aureus, Klebsiella pneumoniae, Acinetobacter baumannii, Pseudomonas aeruginosa, and Enterobacter species), a group of pathogens with a high rate of antibiotic resistance that are responsible for the majority of nosocomial infections.Colloquially, A. baumannii is referred to as ""Iraqibacter"" due to its seemingly sudden emergence in military treatment facilities during the Iraq War. It has continued to be an issue for veterans and soldiers who served in Iraq and Afghanistan. Multidrug-resistant A. baumannii has spread to civilian hospitals in part due to the transport of infected soldiers through multiple medical facilities. During the COVID-19 pandemic, coinfection with A. baumannii secondary to SARS-CoV-2 infections has been reported multiple times in literature."
1,Actinomyces israelii,"Actinomyces israelii is a species of Gram-positive, rod-shaped bacteria within the genus Actinomyces.  Known to live commensally on and within humans, A. israelii is an opportunistic pathogen and a cause of actinomycosis.  Many physiologically diverse strains of the species are known to exist, though not all are strict anaerobes. It was named after the German surgeon James Adolf Israel (1848–1926), who studied the organism for the first time in 1878."
2,Agrobacterium tumefaciens,"Agrobacterium radiobacter (more commonly known as Agrobacterium tumefaciens) is the causal agent of crown gall disease (the formation of tumours) in over 140 species of eudicots. It is a rod-shaped, Gram-negative soil bacterium. Symptoms are caused by the insertion of a small segment of DNA (known as the T-DNA, for 'transfer DNA', not to be confused with tRNA that transfers amino acids during protein synthesis), from a plasmid into the plant cell, which is incorporated at a semi-random location into the plant genome. Plant genomes can be engineered by use of Agrobacterium for the delivery of sequences hosted in T-DNA binary vectors.
Agrobacterium tumefaciens is an alphaproteobacterium of the family Rhizobiaceae, which includes the nitrogen-fixing legume symbionts.  Unlike the nitrogen-fixing symbionts, tumor-producing Agrobacterium species are pathogenic and do not benefit the plant.  The wide variety of plants affected by Agrobacterium makes it of great concern to the agriculture industry.Economically, A. tumefaciens is a serious pathogen of walnuts, grape vines, stone fruits, nut trees, sugar beets, horse radish, and rhubarb, and the persistent nature of the tumors or galls caused by the disease make it particularly harmful for perennial crops.Agrobacterium tumefaciens grows optimally at 28 °C. The doubling time can range from 2.5–4h depending on the media, culture format, and level of aeration. At temperatures above 30 °C, A. tumefaciens begins to experience heat shock which is likely to result in errors in cell division."
3,Anaplasma,"Anaplasma is a genus of bacteria of the alphaproteobacterial order Rickettsiales, family Anaplasmataceae.
Anaplasma species reside in host blood cells and lead to the disease anaplasmosis. The disease most commonly occurs in areas where competent tick vectors are indigenous, including tropical and semitropical areas of the world for intraerythrocytic Anaplasma spp.Anaplasma species are biologically transmitted by Ixodes deer-tick vectors, and the prototypical species, A. marginale, can be mechanically transmitted by biting flies and iatrogenically with blood-contaminated instruments. One of the major consequences of infection by bovine red blood cells by A. marginale is the development of nonhaemolytic anaemia, thus the absence of hemoglobinuria, which allows clinical differentiation from another major tick-borne disease, bovine babesiosis, caused by Babesia bigemina.Species of veterinary interest include:

Anaplasma marginale and Anaplasma centrale in cattle
Anaplasma ovis and Anaplasma mesaeterum in sheep and goats
Anaplasma phagocytophilum in dogs, cats, and horses (see human granulocytic anaplasmosis)
Anaplasma platys in dogs"
4,Anaplasma phagocytophilum,"Anaplasma phagocytophilum (formerly Ehrlichia phagocytophilum) is a Gram-negative bacterium that is unusual in its tropism to neutrophils. It causes anaplasmosis in sheep and cattle, also known as tick-borne fever and pasture fever, and also causes the zoonotic disease human granulocytic anaplasmosis.A. phagocytophilum is a Gram-negative, obligate bacterium of neutrophils. It causes human granulocytic anaplasmosis, which is a tick-borne rickettsial disease. Because this bacterium invades neutrophils, it has a unique adaptation and pathogenetic mechanism."
5,Azorhizobium caulinodans,"Azorhizobium caulinodans is a species of bacteria that forms a nitrogen-fixing symbiosis with plants of the genus Sesbania. The symbiotic relationship between Sesbania rostrata and A. caulinodans lead to nitrogen fixing nodules in S. rostrata. Bacterial chemotaxis plays an important role in establishing this symbiotic relationship.Azorhizobium caulinodans is a genome and it contains chemotaxis gene clusters that are unique. It has five chemotaxis genes which are: cheW(1), cheW, cheA, cheR, and cheB. Azorhizobium caulinodans controls the movements of flagella, and the chemotaxis signaling path in Azorhizobium caulinodans helps with regulating biofilm formation."
6,Azotobacter vinelandii,"Azotobacter vinelandii is Gram-negative diazotroph that can fix nitrogen while grown aerobically. These bacteria are easily cultured and grown.
A. vinelandii is a free-living N2 fixer known to produce many phytohormones and vitamins in soils.  It produces fluorescent pyoverdine pigments."
7,Bacillus,"Bacillus (Latin ""stick"") is a genus of Gram-positive, rod-shaped bacteria, a member of the phylum Bacillota, with 266 named species. The term is also used to describe the shape (rod) of certain bacteria; and the plural Bacilli is the name of the class of bacteria to which this genus belongs.  Bacillus species can be either obligate aerobes: oxygen dependent;  or facultative anaerobes: having the ability to continue living in the absence of oxygen. Cultured Bacillus species test positive for the enzyme catalase if oxygen has been used or is present.Bacillus can reduce themselves to oval endospores and can remain in this dormant state for years. The endospore of one species from Morocco is reported to have survived being heated to 420 °C. Endospore formation is usually triggered by a lack of nutrients: the bacterium divides within its cell wall, and one side then engulfs the other. They are not true spores (i.e., not an offspring).  Endospore formation originally defined the genus, but not all such species are closely related, and many species have been moved to other genera of the Bacillota. Only one endospore is formed per cell. The spores are resistant to heat, cold, radiation, desiccation, and disinfectants. Bacillus anthracis needs oxygen to sporulate; this constraint has important consequences for epidemiology and control. In vivo, B. anthracis produces a polypeptide (polyglutamic acid) capsule that kills it from phagocytosis. The genera Bacillus and Clostridium constitute the family Bacillaceae. Species are identified by using morphologic and biochemical criteria. Because the spores of many Bacillus species are resistant to heat, radiation, disinfectants, and desiccation, they are difficult to eliminate from medical and pharmaceutical materials and are a frequent cause of contamination. Not only are they resistant to heat, radiation, etc., but they are also resistant to chemicals such as antibiotics. This resistance allows them to survive for many years and especially in a controlled environment. Bacillus species are well known in the food industries as troublesome spoilage organisms.Ubiquitous in nature, Bacillus includes symbiotic(sometimes referred to as endophytes) as well as independent species. Two parasitic pathogenic species are medically significant: B. anthracis causes anthrax; and B. cereus causes food poisoning.
Many species of Bacillus can produce copious amounts of enzymes, which are used in various industries, such as in the production of alpha amylase used in starch hydrolysis and the protease subtilisin used in detergents. B. subtilis  is a valuable model for bacterial research. 
Some Bacillus species can synthesize and secrete lipopeptides, in particular surfactins and mycosubtilins. Bacillus species are also found in marine sponges. Marine sponge associated Bacillus subtilis (strains WS1A and YBS29) can synthesize several antimicrobial peptides. These Bacillus subtilis strains can develop disease resistance in Labeo rohita."
8,Bacillus anthracis,"Bacillus anthracis is a Gram-positive and rod-shaped bacterium that causes anthrax, a deadly disease to livestock and, occasionally, to humans. It is the only permanent (obligate) pathogen within the genus Bacillus. Its infection is a type of zoonosis, as it is transmitted from animals to humans. It was discovered by a German physician Robert Koch in 1876, and became the first bacterium to be experimentally shown as a pathogen. The discovery was also the first scientific evidence for the germ theory of diseases.B. anthracis measures about 3 to 5 μm long and 1 to 1.2 μm wide.  The reference genome consists of a 5,227,419 bp circular chromosome and two extrachromosomal DNA plasmids, pXO1 and pXO2, of 181,677 and 94,830 bp respectively, which are responsible for the pathogenicity. It forms a protective layer called endospore by which it can remain inactive for many years and suddenly becomes infective under suitable environmental conditions. Because of the resilience of the endospore, the bacterium is one of the most popular biological weapons. The protein capsule (poly-D-gamma-glutamic acid) is key to evasion of the immune response. It feeds on the heme of blood protein haemoglobin using two secretory siderophore proteins, IsdX1 and IsdX2.

Untreated B. anthracis infection is usually deadly. Infection is indicated by inflammatory, black, necrotic lesion (eschar). The sores usually appear on the face, neck, arms, or hands. The fatal symptoms include flu-like fever, chest discomfort, diaphoresis, and body aches. The first animal vaccine against anthrax was developed by French chemist Louis Pasteur in 1881. Different animal and human vaccines are now available. The infection can be treated with common antibiotics such as penicillins, quinolones, and tetracyclines."
9,Bacillus cereus,"Bacillus cereus is a Gram-positive, rod-shaped, facultatively anaerobic, motile, beta-hemolytic, spore-forming bacterium commonly found in soil, food and marine sponges. The specific name, cereus, meaning ""waxy"" in Latin, refers to the appearance of colonies grown on blood agar. Some strains are harmful to humans and cause foodborne illness, while other strains can be beneficial as probiotics for animals. The bacteria is classically contracted from fried rice dishes that have been sitting at room temperature for hours. B. cereus bacteria are facultative anaerobes, and like other members of the genus Bacillus, can produce protective endospores. Its virulence factors include phospholipase C, cereulide, sphingomyelinase,  metalloproteases, and cytotoxin K.The Bacillus cereus group comprises seven closely related species: B. cereus sensu stricto (referred to herein as B. cereus), B. anthracis, B. thuringiensis, B. mycoides, B. pseudomycoides, and B. cytotoxicus; or as six species in a Bacillus cereus sensu lato: B. weihenstephanensis, B. mycoides, B. pseudomycoides, B. cereus, B. thuringiensis, and B. anthracis."
10,Bacillus licheniformis,"Bacillus licheniformis is a bacterium commonly found in the soil. It is found on bird feathers, especially chest and back plumage, and most often in ground-dwelling birds (like sparrows) and aquatic species (like ducks).
It is a gram-positive, mesophilic bacterium. Its optimal growth temperature is around 50 °C, though it can survive at much higher temperatures. The optimal temperature for enzyme secretion is 37 °C. It can exist in a dormant spore form to resist harsh environments, or in a vegetative state when conditions are good.
High capacity of secretion of the alkaline serine protease has made B. licheniformis one of the most important  bacteria in industrial enzyme production.  Subtilisin Carlsberg (P00780) secreted by B. licheniformis is used as a detergent protease. It is sold under the name Alcalase by Novozymes. A small antisense RNA against Subtilisin Carlsberg named BLi_r0872 was  discovered in an RNA-seq based study. It may have a putative impact on protease production and serve as target for strain improvement.Scientists are currently exploring its ability to degrade feathers for agricultural purposes. Feathers contain high amounts of non-digestible proteins, but researchers hope that, through fermentation with B. licheniformis, they can use waste feathers to produce cheap and nutritious feather meal to feed livestock.
Ecological research is also being done looking at the interaction between plumage colors and B. licheniformis activity, and the consequences thereof. Feather degrading bacteria may have played an important role in the evolution of molting, and patterns in feather coloration (Gloger's Rule)."
11,Bacillus megaterium,"Bacillus megaterium is a rod-like, Gram-positive, mainly aerobic spore forming bacterium found in widely diverse habitats. With a cell length of up to 4 µm and a diameter of 1.5 µm, B. megaterium is amongst the biggest known bacteria. The cells often occur in pairs and chains, where the cells are joined together by polysaccharides on the cell walls.
In the 1960s, prior to the utilization of Bacillus subtilis for this purpose, B. megaterium was the main model organism among Gram-positive bacteria for intensive studies on biochemistry, sporulation and bacteriophages. Recently, its popularity has started increasing in the field of biotechnology for its recombinant protein production capacity.This species has been recently transferred into the genus Priestia. The correct nomenclature is Priestia megaterium."
12,Bacillus mycoides,"Bacillus mycoides is a bacterium of the genus Bacillus. Like other Bacillus species, B. mycoides is Gram positive, rod-shaped, and forms spores. B. mycoides is distinguished from other Bacillus species by its unusual growth on agar plates, where it forms expansive hairy colonies with characteristic swirls."
13,Bacillus subtilis,"Bacillus subtilis, known also as the hay bacillus or grass bacillus, is a Gram-positive, catalase-positive bacterium, found in soil and the gastrointestinal tract of ruminants, humans and marine sponges. As a member of the genus Bacillus, B. subtilis is rod-shaped, and can form a tough, protective endospore, allowing it to tolerate extreme environmental conditions. B. subtilis has historically been classified as an obligate aerobe, though evidence exists that it is a facultative anaerobe. B. subtilis is considered the best studied Gram-positive bacterium and a model organism to study bacterial chromosome replication and cell differentiation. It is one of the bacterial champions in secreted enzyme production and used on an industrial scale by biotechnology companies."
14,Bacillus thuringiensis,"Bacillus thuringiensis (or Bt) is a Gram-positive, soil-dwelling bacterium, the most commonly used biological pesticide worldwide. B. thuringiensis also occurs naturally in the gut of caterpillars of various types of moths and butterflies, as well on leaf surfaces, aquatic environments, animal feces, insect-rich environments, and flour mills and grain-storage facilities. It has also been observed to parasitize other moths such as Cadra calidella—in laboratory experiments working with C. calidella, many of the moths were diseased due to this parasite.During sporulation, many Bt strains produce crystal proteins (proteinaceous inclusions), called delta endotoxins, that have insecticidal action. This has led to their use as insecticides, and more recently to genetically modified crops using Bt genes, such as Bt corn. Many crystal-producing Bt strains, though, do not have insecticidal properties. The subspecies israelensis is commonly used for control of mosquitoes and of fungus gnats.As a toxic mechanism, cry proteins bind to specific receptors on the membranes of mid-gut (epithelial) cells of the targeted pests, resulting in their rupture. Other organisms (including humans, other animals and non-targeted insects) that lack the appropriate receptors in their gut cannot be affected by the cry protein, and therefore are not affected by Bt."
15,Bacteroides,"Bacteroides is a genus of Gram-negative, obligate anaerobic bacteria. Bacteroides species are non endospore-forming bacilli, and may be either motile or nonmotile, depending on the species. The DNA base composition is 40–48% GC. Unusual in bacterial organisms, Bacteroides membranes contain sphingolipids. They also contain meso-diaminopimelic acid in their peptidoglycan layer.
Bacteroides species are normally mutualistic, making up the most substantial portion of the mammalian gastrointestinal microbiota, where they play a fundamental role in processing of complex molecules to simpler ones in the host intestine. As many as 1010–1011 cells per gram of human feces have been reported. They can use simple sugars when available; however, the main sources of energy for Bacteroides species in the gut are complex host-derived and plant glycans.  Studies indicate that long-term diet is strongly associated with the gut microbiome composition—those who eat plenty of protein and animal fats have predominantly Bacteroides bacteria, while for those who consume more carbohydrates the Prevotella species dominate.One of the most important clinically is Bacteroides fragilis.
Bacteroides melaninogenicus has recently been reclassified and split into Prevotella melaninogenica and Prevotella intermedia."
16,Bacteroides fragilis,"Bacteroides fragilis is an anaerobic, Gram-negative, pleomorphic to rod-shaped bacterium. It is part of the normal microbiota of the human colon and is generally commensal, but can cause infection if displaced into the bloodstream or surrounding tissue following surgery, disease, or trauma."
17,Porphyromonas gingivalis,"Porphyromonas gingivalis belongs to the phylum Bacteroidota and is a nonmotile, Gram-negative, rod-shaped, anaerobic, pathogenic bacterium. It forms black colonies on blood agar.
It is found in the oral cavity, where it is implicated in periodontal disease, as well as in the upper gastrointestinal tract, the respiratory tract and the colon. It has been isolated from women with bacterial vaginosis.Collagen degradation observed in chronic periodontal disease results in part from the collagenase enzymes of this species. It has been shown in an in vitro study that P. gingivalis can invade human gingival fibroblasts and can survive in the presence of antibiotics. P. gingivalis invades gingival epithelial cells in high numbers, in which case both bacteria and epithelial cells survive for extended periods of time. High levels of specific antibodies can be detected in patients harboring P. gingivalis.
P. gingivalis infection has been linked to Alzheimer's disease and rheumatoid arthritis. It contains the enzyme peptidyl-arginine deiminase, which is involved in citrullination. Patients with rheumatoid arthritis have increased incidence of periodontal disease; antibodies against the bacterium are significantly more common in these patients.P. gingivalis is divided into K-serotypes based upon capsular antigenicity of the various types. These serotypes have been the drivers of observations regarding bacterial cell to cell interactions to the associated serotype-dependent immune response and risk with pancreatic cancer."
18,Bartonella,"Bartonella is a genus of Gram-negative bacteria. It is the only genus in the family Bartonellaceae. Facultative intracellular parasites, Bartonella species can infect healthy people, but are considered especially important as opportunistic pathogens. Bartonella species are transmitted by vectors such as ticks, fleas, sand flies, and mosquitoes. At least eight Bartonella species or subspecies are known to infect humans.Bartonella henselae is the organism responsible for cat scratch disease."
19,Bartonella henselae,"Bartonella henselae, formerly Rochalimæa henselae, is a proteobacterium that is the causative agent of cat-scratch disease (bartonellosis).
Bartonella henselae is a member of the genus Bartonella, one of the most common types of bacteria in the world. It is a facultative intracellular microbe that targets red blood cells. One study showed it invaded the mature blood cells of humans. It infects the host cell by sticking to it using trimeric autotransporter adhesins.   In the United States, about 22,000 people(per year?)are diagnosed, most under the age of 20. Most often, it is transmitted from kittens."
20,Bartonella quintana,"Bartonella quintana, originally known as Rochalimaea quintana, and ""Rickettsia quintana"", is a bacterium transmitted by the human body louse that causes trench fever. This bacterial species caused outbreaks of trench fever affecting 1 million soldiers in Europe during World War I."
21,Bordetella,"Bordetella () is a genus of small (0.2 – 0.7 µm), gram-negative coccobacilli of the phylum Proteobacteria. Bordetella species, with the exception of B. petrii, are obligate aerobes, as well as highly fastidious, or difficult to culture. All species can infect humans. The first three species to be described (B. pertussis, B. parapertussis, B. bronchiseptica); are sometimes referred to as the 'classical species'. Two of these (B. bronchiseptica and B. pertussis) are also motile.B. pertussis and occasionally B. parapertussis cause pertussis or whooping cough in humans, and some B. parapertussis strains can colonise sheep. B. bronchiseptica rarely infects healthy humans, though disease in immunocompromised patients has been reported. B. bronchiseptica causes several diseases in other mammals, including kennel cough and atrophic rhinitis in dogs and pigs, respectively. Other members of the genus cause similar diseases in other mammals, and in birds (B. hinzii, B. avium).
The genus Bordetella is named after Jules Bordet."
22,Bordetella bronchiseptica,"Bordetella bronchiseptica is a small, gram-negative, rod-shaped bacterium of the genus Bordetella. It can cause infectious bronchitis in dogs and other animals, but rarely infects humans. Closely related to B. pertussis—the obligate human pathogen that causes pertussis (whooping cough); B. bronchiseptica can persist in the environment for extended periods."
23,Bordetella pertussis,"Bordetella pertussis is a Gram-negative, aerobic, pathogenic, encapsulated coccobacillus of the genus Bordetella, and the causative agent of pertussis or whooping cough. Like B. bronchiseptica, B. pertussis is motile and expresses a flagellum-like structure. Its virulence factors include pertussis toxin, adenylate cyclase toxin, filamentous hæmagglutinin, pertactin, fimbria, and tracheal cytotoxin.
The bacterium is spread by airborne droplets; its incubation period is 7–10 days on average (range 6–20 days).  Humans are the only known reservoir for B. pertussis. The complete B. pertussis genome of 4,086,186 base pairs was published in 2003. Compared to its closest relative B. bronchiseptica, the genome size is greatly reduced. This is mainly due to the adaptation to one host species (human) and the loss of capability of survival outside of a host body."
24,Borrelia burgdorferi,"Borrelia burgdorferi is a bacterial species of the spirochete class in the genus Borrelia, and is one of the causative agents of Lyme disease in humans. Along with a few similar genospecies, some of which also cause Lyme disease, it makes up the species complex of Borrelia burgdorferi sensu lato. The complex currently comprises 20 accepted and 3 proposed genospecies. B. burgdorferi sensu stricto exists in North America and Eurasia and until 2016 was the only known cause of Lyme disease in North America. Borrelia species are Gram-negative."
