,Name,Description
25,Brucella,"Brucella is a genus of Gram-negative bacteria, named after David Bruce (1855–1931). They are small (0.5 to 0.7 by 0.6 to 1.5 µm), nonencapsulated, nonmotile, facultatively intracellular coccobacilli.
Brucella spp. are the cause of brucellosis, which is a zoonosis transmitted by ingesting contaminated food (such as unpasteurized milk products), direct contact with an infected animal, or inhalation of aerosols. Transmission from human to human, for example, through sexual intercourse, or from mother to child, is exceedingly rare, but possible. Minimum infectious exposure is between 10 and 100 organisms.
The different species of Brucella are genetically very similar, although each has a slightly different host specificity. Hence, the National Center for Biotechnology Information taxonomy includes most Brucella species under B. melitensis.
The many names of brucellosis include (human disease/animal disease):

Malta fever/Bang's disease
Undulant fever/enzootic abortion
Mediterranean fever/epizootic abortion
Rock fever of Gibraltar/slinking of calves
Gastric fever/ram epididymitis
Contagious abortion/spontaneous abortion"
26,Brucella abortus,"Brucella abortus is a Gram-negative alpha-proteobacterium in the family Brucellaceae and is one of the causative agents of brucellosis. The rod-shaped pathogen is classified under the domain Bacteria. The prokaryotic B. abortus is non-spore-forming, non-motile and aerobic."
27,Brucella melitensis,"Brucella melitensis is a Gram-negative coccobacillus bacterium from the Brucellaceae family. The bacterium causes ovine brucellosis, along with Brucella ovis. It affects primarily sheep and goats, but cases have also been observed in cattle, yaks, water buffalo, Bactrian and dromedary camels,  alpacas, dogs, horses and pigs. Humans can become infected if they have contact with an infected animal or its byproducts. Animals acquire B. melitensis by venereal transmission and contact with the placenta, fetus, fetal fluids, and vaginal discharges from infected animals. The organism is found in blood, urine, milk, and semen.  It is zoonotic, unlike B. ovis, causing Malta fever or localized brucellosis in humans."
28,Brucella suis,"Brucella suis is a bacterium that causes swine brucellosis, a zoonosis that affects pigs. The disease typically causes chronic inflammatory lesions in the reproductive organs of susceptible animals or orchitis, and may even affect joints and other organs. The most common symptom is abortion in pregnant susceptible sows at any stage of gestation. Other manifestations are temporary or permanent sterility, lameness, posterior paralysis, spondylitis, and abscess formation.  It is transmitted mainly by ingestion of infected tissues or fluids, semen during breeding, and suckling infected animals.Since brucellosis threatens the food supply and causes undulant fever, Brucella suis and other Brucella species (B. melitensis, B. abortis, B. ovis, B. canis) are recognized as potential agricultural, civilian, and military bioterrorism agents."
29,Burkholderia,"Burkholderia is a genus of Proteobacteria whose pathogenic members include the Burkholderia cepacia complex, which attacks humans and Burkholderia mallei, responsible for glanders, a disease that occurs mostly in horses and related animals; Burkholderia pseudomallei, causative agent of melioidosis; and Burkholderia cepacia, an important pathogen of pulmonary infections in people with cystic fibrosis (CF). Burkholderia species is also found marine environment. S.I. Paul et al. (2021) isolated and characterized Burkholderia cepacia from marine sponges of the Saint Martin's Island of the Bay of Bengal, Bangladesh.The Burkholderia (previously part of Pseudomonas) genus name refers to a group of virtually ubiquitous Gram-negative, obligately aerobic, rod-shaped bacteria that are motile by means of single or multiple polar flagella, with the exception of Burkholderia mallei, which is nonmotile. Members belonging to the genus do not produce sheaths or prosthecae and are able to use poly-beta-hydroxybutyrate (PHB) for growth. The genus includes both animal and plant pathogens, as well as some environmentally important species. In particular, B. xenovorans (previously named Pseudomonas cepacia then B. cepacia and B. fungorum) is renowned for being catalase positive (affecting patients with chronic granulomatous disease) and its ability to degrade chlororganic pesticides and polychlorinated biphenyls. The conserved RNA structure anti-hemB RNA motif is found in all known bacteria in this genus.Due to their antibiotic resistance and the high mortality rate from their associated diseases, B. mallei and B. pseudomallei are considered to be potential biological warfare agents, targeting livestock and humans."
30,Burkholderia mallei,"Burkholderia mallei is a Gram-negative, bipolar, aerobic bacterium, a human and animal pathogen of genus Burkholderia causing glanders; the Latin name of this disease (malleus) gave its name to the species causing it. It is closely related to B. pseudomallei, and by multilocus sequence typing it is a subspecies of B. pseudomallei. B. mallei evolved from B. pseudomallei by selective reduction and deletions from the B. pseudomallei genome.  Unlike B. pseudomallei and other genus members, B. mallei is nonmotile; its shape is coccobacillary measuring some 1.5–3.0 μm in length and 0.5–1.0 μm in diameter with rounded ends."
31,Burkholderia pseudomallei,"Burkholderia pseudomallei (also known as Pseudomonas pseudomallei) is a Gram-negative, bipolar, aerobic, motile rod-shaped bacterium. It is a soil-dwelling bacterium endemic in tropical and subtropical regions worldwide, particularly in Thailand and northern Australia. Recently, there has been an expansion of the affected regions due to significant natural disasters and it can now be found in Southern China, Hong Kong, and countries in America. Although it is mainly a soil-dwelling bacteria, a study performed by Apinya Pumpuang and others showed that Burkholderia pseudomallei survived in distilled water for 16 years, demonstrating that it is capable of living in water if a specific environment is provided. It is resistant to variety of harsh conditions including nutrient deficiency, extreme temperature or PH scale. It infects humans and other animals most commonly livestock such as goats, pigs, and sheep. It happens less frequently in other animals, but is possible for them to get infected and causes the disease melioidosis. It is also capable of infecting plants in a labatory setting.Burkholderia pseudomallei measures 2–5 μm in length and 0.4–0.8 μm in diameter and is capable of self-propulsion using flagellum.  The bacteria can grow in a number of artificial nutrient environments, especially betaine-  and arginine-containing ones.
In vitro, optimal proliferation temperature is reported around 40 °C in neutral or slightly acidic environments (pH  6.8–7.0). The majority of strains are capable of oxidation, not fermentation, of sugars without gas formation (most importantly, glucose and galactose; older cultures are reported to also metabolize maltose and starch). Bacteria produce both exo- and  endotoxins.  The role of the toxins identified in the process of melioidosis symptom development has not been fully elucidated."
32,Campylobacter,"Campylobacter (meaning ""curved bacteria"") is a genus of Gram-negative bacteria. Campylobacter typically appear comma- or s-shaped, and are motile. Some Campylobacter species can infect humans, sometimes causing campylobacteriosis, a diarrhoeal disease in humans. Campylobacteriosis is usually self-limiting and antimicrobial treatment is often not required, except in severe cases or immunocompromised patients. The most known source for Campylobacter is poultry, but due to their diverse natural reservoir, Campylobacter spp. can also be transmitted via water. Other known sources of Campylobacter infections include food products, such as unpasteurised milk and contaminated fresh produce. Sometimes the source of infection can be direct contact with infected animals, which often carry Campylobacter asymptomatically. At least a dozen species of Campylobacter have been implicated in human disease, with C. jejuni (80–90%) and C. coli (5-10%) being the most common. C. jejuni is recognized as one of the main causes of bacterial foodborne disease in many developed countries. It is the number one cause of bacterial gastroentritis in Europe, with over 246,000 cases confirmed annually. C. jejuni infection can also cause bacteremia in immunocompromised individuals, while C. lari is a known cause of recurrent diarrhea in children. C. fetus can cause spontaneous abortions in cattle and sheep, and is  an opportunistic pathogen in humans."
33,Campylobacter coli,"Campylobacter coli is a Gram-negative, microaerophilic, non-endospore-forming, S-shaped bacterial species within genus Campylobacter. In humans, it C. coli can cause campylobacteriosis, a diarrhoeal disease which is the most frequently reported foodborne illness in the European Union. C. coli grows slowly with an optimum temperature of 42 °C. When exposed to air for long periods, they become spherical or coccoid shaped."
34,Campylobacter fetus,"Campylobacter fetus is a rod-shaped, gram-negative species of bacteria within the genus Campylobacter of phylum Proteobacteria. Identification of C. fetus species in infected animals or people is routinely performed by culture on blood or cefoperazone deoxycholate agar. Subspecies of C. fetus commonly causes reproductive disease in ruminants and gastrointestinal disease in humans. Transmission of C. fetus subspecies venerealis occurs mainly through venereal contact while transmission of C. fetus subspecies fetus occurs mainly through ingestion of bacteria in a contaminated environment. Infertility in cattle and abortion in sheep are common outcomes of infection associated with C. fetus subspecies venerealis and C. fetus subspecies fetus, respectively. Disease in humans occurs through zoonotic transmission of C. fetus mainly via ingestion of contaminated food or water sources. C. fetus can be diagnosed with polymerase chain reaction assays, enzyme linked immunosorbent assays and vaginal mucus agglutination testing. As vaccines are typically not efficient in preventing future spread, infected bulls are often culled. Human infections may be treated with erythromycin as antimicrobial resistance has been emerging for the fluoroquinolones."
35,Campylobacter jejuni,"Campylobacter jejuni () is one of the most common causes of food poisoning in Europe and in the US. The vast majority of cases occur as isolated events, not as part of recognized outbreaks. Active surveillance through the Foodborne Diseases Active Surveillance Network (FoodNet) indicates that about 20 cases are diagnosed each year for each 100,000 people in the US, while many more cases are undiagnosed or unreported; the CDC estimates a total of 1.5 million infections every year. The European Food Safety Authority reported 246,571 cases in 2018, and estimated approximately nine million cases of human campylobacteriosis per year in the European Union.Campylobacter jejuni is in a genus of bacteria that is among the most common causes of bacterial infections in humans worldwide. Campylobacter means ""curved rod"", deriving from the Greek kampylos (curved) and baktron (rod). Of its many species, C. jejuni is considered one of the most important from both a microbiological and public health perspective.C. jejuni is commonly associated with poultry, and is also commonly found in animal feces. Campylobacter is a helical-shaped, non-spore-forming, Gram-negative, microaerophilic, nonfermenting motile bacterium with a single flagellum at one or both poles, which are also oxidase-positive and grow optimally at 37 to 42 °C. When exposed to atmospheric oxygen, C. jejuni is able to change into a coccal form. This species of pathogenic bacteria is one of the most common causes of human gastroenteritis in the world. Food poisoning caused by Campylobacter species can be severely debilitating, but is rarely life-threatening. It has been linked with subsequent development of Guillain–Barré syndrome, which usually develops two to three weeks after the initial illness. Individuals with recent C. jejuni infections develop Guillain-Barré syndrome at a rate of 0.3 per 1000 infections, about 100 times more often than the general population. Another chronic condition that may be associated with Campylobacter infection is reactive arthritis. Reactive arthritis is a complication strongly associated with a particular genetic make-up. That is, persons who have the human leukocyte antigen B27 (HLA-B27) are most susceptible. Most often, the symptoms of reactive arthritis will occur up to several weeks after infection."
36,Helicobacter pylori,"Helicobacter pylori, previously known as Campylobacter pylori, is a gram-negative, microaerophilic, spiral (helical) bacterium usually found in the stomach. Its helical shape (from which the genus name, helicobacter, derives) is thought to have evolved in order to penetrate the mucoid lining of the stomach and thereby establish infection. The bacterium was first identified in 1982 by the Australian doctors Barry Marshall and Robin Warren. H. pylori has been associated with cancer of the mucosa-associated lymphoid tissue in the stomach, esophagus, colon, rectum, or tissues around the eye (termed extranodal marginal zone B-cell lymphoma of the cited organ), and of lymphoid tissue in the stomach (termed diffuse large B-cell lymphoma).H. pylori infection usually has no symptoms but sometimes causes gastritis (stomach inflammation) or ulcers of the stomach or first part of the small intestine. The infection is also associated with the development of certain cancers. Many investigators have suggested that H. pylori causes or prevents a wide range of other diseases, but many of these relationships remain controversial.Some studies suggest that H. pylori plays an important role in the natural stomach ecology, e.g. by influencing the type of bacteria that colonize the gastrointestinal tract. Other studies suggest that non-pathogenic strains of H. pylori may beneficially normalize stomach acid secretion, and regulate appetite.In 2015, it was estimated that over 50% of the world's population had H. pylori in their upper gastrointestinal tracts with this infection (or colonization) being more common in developing countries. In recent decades, however, the prevalence of H. pylori colonization of the gastrointestinal tract has declined in many countries."
37,Chlamydia trachomatis,"Chlamydia trachomatis (), commonly known as chlamydia, is a bacterium that causes chlamydia, which can manifest in various ways, including: trachoma, lymphogranuloma venereum, nongonococcal urethritis, cervicitis, salpingitis, pelvic inflammatory disease. C. trachomatis is the most common infectious cause of blindness and the most common sexually transmitted bacterium.Different types of C. trachomatis cause different diseases. The most common strains cause disease in the genital tract, while other strains cause disease in the eye or lymph nodes. Like other Chlamydia species, the C. trachomatis life cycle consists of two morphologically distinct life stages: elementary bodies and reticulate bodies. Elementary bodies are spore-like and infectious, whereas reticulate bodies are in the replicative stage and are seen only within host cells."
38,Chlamydophila,Chlamydophila is a controversial bacterial genus belonging to the family Chlamydiaceae.
39,Clostridium,"Clostridium is a genus of Gram-positive bacteria. This genus includes several significant human pathogens, including the causative agents of botulism and tetanus. The genus formerly included an important cause of diarrhea, Clostridioides difficile, which was reclassified into the Clostridioides genus in 2016. They are obligate anaerobes capable of producing endospores. The normal, reproducing cells of Clostridium, called the vegetative form, are rod-shaped, which gives them their name, from the Greek κλωστήρ or spindle. Clostridium endospores have a distinct bowling pin or bottle shape, distinguishing them from other bacterial endospores, which are usually ovoid in shape. Clostridium species inhabit soils and the intestinal tract of animals, including humans. Clostridium is a normal inhabitant of the healthy lower reproductive tract of females.The genus, as traditionally defined, contains many organisms not closely related to its type species. The issue was originally illustrated in full detail by a rRNA phylogeny from Collins 1994, which split the traditional genus (now corresponding to a large slice of Clostridia) into twenty clusters, with cluster I containing the type species and its close relatives. Over the years, this has resulted in many new genera being split out, with the ultimate goal of constraining Clostridium to cluster I.""Clostridium"" cluster XIVa and ""Clostridium"" cluster IV efficiently ferment plant polysaccharide composing dietary fiber, making them important and abundant taxa in the rumen and the human large intestine. As mentioned before, these clusters are not part of current Clostridium, and use of these terms should be avoided due to ambiguous or inconsistent usage."
40,Clostridium botulinum,"Clostridium botulinum is a Gram-positive, rod-shaped, anaerobic, spore-forming, motile bacterium with the ability to produce the neurotoxin botulinum.The botulinum toxin can cause botulism, a severe flaccid paralytic disease in humans and other animals, and is the most potent toxin known to mankind, natural or synthetic, with a lethal dose of 1.3–2.1 ng/kg in humans.C. botulinum is a diverse group of pathogenic bacteria initially grouped together by their ability to produce botulinum toxin and now known as four distinct groups, C. botulinum groups I–IV, as well as some strains of Clostridium butyricum and Clostridium baratii, are the bacteria responsible for producing botulinum toxin.C. botulinum is responsible for foodborne botulism (ingestion of preformed toxin), infant botulism (intestinal infection with toxin-forming C. botulinum), and wound botulism (infection of a wound with C. botulinum).  C. botulinum produces heat-resistant endospores that are commonly found in soil and are able to survive under adverse conditions.C. botulinum is commonly associated with bulging canned food; bulging, misshapen cans can be due to an internal increase in pressure caused by gas produced by the bacteria."
41,Clostridium tetani,"Clostridium tetani is a common soil bacterium and the causative agent of tetanus. Vegetative cells of C. tetani are usually rod-shaped and up to 2.5 μm long, but they become enlarged and tennis racket- or drumstick-shaped when forming spores. C. tetani spores are extremely hardy and can be found globally in soil or in the gastrointestinal tract of animals. If inoculated into a wound, C. tetani can grow and produce a potent toxin, tetanospasmin, which interferes with motor neurons, causing tetanus. The toxin's action can be prevented with tetanus toxoid vaccines, which are often administered to children worldwide."
42,Corynebacterium,"Corynebacterium () is a genus of bacteria that are Gram-positive and most are aerobic. They are bacilli (rod-shaped), and in some phases of life they are, more specifically, club-shaped, which inspired the genus name (coryneform means ""club-shaped"").
They are widely distributed in nature in the microbiota of animals (including the human microbiota) and are mostly innocuous, most commonly existing in commensal relationships with their hosts.  Some are useful in industrial settings such as C. glutamicum. Others can cause human disease, including most notably diphtheria, which is caused by C. diphtheriae. As with various species of a microbiota (including their relatives in the genera Arcanobacterium and Trueperella), they usually are not pathogenic, but can occasionally opportunistically capitalize on atypical access to tissues (via wounds) or weakened host defenses."
43,Corynebacterium diphtheriae,"Corynebacterium diphtheriae is the pathogenic bacterium that causes diphtheria. It is also known as the Klebs–Löffler bacillus, because it was discovered in 1884 by German bacteriologists Edwin Klebs (1834–1912) and Friedrich Löffler (1852–1915)."
44,Ehrlichia chaffeensis,"Ehrlichia chaffeensis is an obligate intracellular, Gram-negative species of Rickettsiales bacteria. It is a zoonotic pathogen transmitted to humans by the lone star tick (Amblyomma americanum). It is the causative agent of human monocytic ehrlichiosis.Genetic studies support the endosymbiotic theory that a subset of these organisms evolved to live inside mammalian cells as mitochondria to provide cellular energy to the cells in return for protection and sustenance.  ATP production in the rickettsiae is biochemically identical to that in mammalian mitochondria;  all multi-cellular eukaryotes have mitochondria in their cells, including birds, fish, reptiles, invertebrates, plants, and fungi in addition to mammals.
Human monocytic ehrlichiosis caused by E. chaffeensis is known to spread through tick infection primarily in the Southern, South-central and Mid-Atlantic regions of the United States. In recent years, the lone star tick has expanded its range along the East Coast to New England, putting more humans at risk for tick-borne infections.It is named for Fort Chaffee, where the bacterium was first discovered in blood samples of infected patients."
45,Eikenella corrodens,"Eikenella corrodens is a Gram-negative facultative anaerobic bacillus that can cause severe invasive disease in humans. It was first identified by M. Eiken in 1958, who called it Bacteroides corrodens. E. corrodens is a rare pericarditis associated pathogen. It is a fastidious, slow growing, human commensal bacillus, capable of acting as an opportunistic pathogen and causing abscesses in several anatomical sites, including the liver, lung, spleen, and submandibular region. E. corrodens could independently cause serious infection in both immunocompetent and immunocompromised hosts."
46,Enterobacter cloacae,"Enterobacter cloacae is a clinically significant Gram-negative, facultatively-anaerobic, rod-shaped bacterium."
47,Enterococcus,"Enterococcus is a large genus of lactic acid bacteria of the phylum Bacillota. Enterococci are gram-positive cocci that often occur in pairs (diplococci) or short chains, and are difficult to distinguish from streptococci on physical characteristics alone. Two species are common commensal organisms in the intestines of humans: E. faecalis (90–95%) and E. faecium (5–10%). Rare clusters of infections occur with other species, including E. casseliflavus, E. gallinarum, and E. raffinosus."
48,Enterococcus avium,"Enterococcus avium, a species of Enterococcus, is most commonly found in birds.  Rarely, it is also a cause of infection in humans, and in such cases, may be vancomycin-reistant, and is referred to as VREA.  VREA cases in humans have been successfully treated with linezolid."
49,Enterococcus durans,"Enterococcus durans is a species of Enterococcus.
It is a gram-positive, catalase- and oxidase-negative, coccus bacterium. The organism is also a facultative anaerobic organism. Prior to 1984, it was known as Streptococcus durans.Certain strains have also been identified as producers of anti-inflammatory agents, which are being studied in medical research."
50,Enterococcus faecalis,"Enterococcus faecalis – formerly classified as part of the group D Streptococcus system – is a Gram-positive, commensal bacterium inhabiting the gastrointestinal tracts of humans. Like other species in the genus Enterococcus, E. faecalis is found in healthy humans and can be used as a probiotic. The probiotic strains such as Symbioflor1 and EF-2001 are characterized by the lack of specific genes related to drug resistance and pathogenesis. As an opportunistic pathogen, E. faecalis can cause life-threatening infections, especially in the nosocomial (hospital) environment, where the naturally high levels of antibiotic resistance found in E. faecalis contribute to its pathogenicity.E. faecalis has been frequently found in reinfected, root canal-treated teeth in prevalence values ranging from 30% to 90% of the cases. Re-infected root canal-treated teeth are about nine times more likely to harbor E. faecalis than cases of primary infections."
51,Enterococcus faecium,"Enterococcus faecium is a Gram-positive, gamma-hemolytic or non-hemolytic bacterium in the genus Enterococcus. It can be commensal (innocuous, coexisting organism) in the gastrointestinal tract of humans and animals, but it may also be pathogenic, causing diseases such as neonatal meningitis or endocarditis.
Vancomycin-resistant E. faecium is often referred to as VRE."
